{
  "$schema": "../../../../bdd-spec.schema.json",
  "schemaVersion": "1.0.0",
  "sourceFile": "packages/plugin/src/rules/no-banned-types.ts",
  "module": {
    "name": "no-banned-types",
    "description": "Ban ReturnType and indexed access types.",
    "exports": ["noBannedTypes"]
  },
  "specifications": [
    {
      "feature": "Permitted type usages",
      "scenarios": [
        {
          "name": "should allow explicit return type annotations that are not ReturnType",
          "given": "a function with a concrete return type annotation",
          "when": "the rule evaluates the code",
          "then": "no violation is reported"
        },
        {
          "name": "should allow standard utility types such as Partial or Readonly",
          "given": "a type alias using Partial<T>",
          "when": "the rule evaluates the code",
          "then": "no violation is reported"
        }
      ]
    },
    {
      "feature": "Banned type usages",
      "scenarios": [
        {
          "name": "should report the use of ReturnType<typeof fn>",
          "given": "a type annotation using ReturnType<typeof someFunction>",
          "when": "the rule evaluates the code",
          "then": "a noBannedTypes violation is reported"
        },
        {
          "name": "should report indexed access types such as Obj['key']",
          "given": "a type annotation using an indexed access type T['key']",
          "when": "the rule evaluates the code",
          "then": "a noBannedTypes violation is reported"
        }
      ]
    }
  ]
}
