{
  "$schema": "../../../bdd-spec.schema.json",
  "schemaVersion": "1.0.0",
  "sourceFile": "packages/plugin/src/rule-map.ts",
  "module": {
    "name": "rule-map",
    "description": "Builds the canonical plugin rule map and exports preset-aware rule configurations for consumption by flat and legacy config builders.",
    "exports": ["IRuleConfig", "buildRules", "ruleMap"]
  },
  "specifications": [
    {
      "feature": "buildRules",
      "scenarios": [
        {
          "name": "should return preset-specific entries for the Recommended preset",
          "given": "Preset.Recommended is passed to buildRules",
          "when": "buildRules is called",
          "then": "returns a rules record where default preset rules use their configured recommended entries"
        },
        {
          "name": "should return preset-specific entries for the Strict preset",
          "given": "Preset.Strict is passed to buildRules",
          "when": "buildRules is called",
          "then": "returns a rules record where default preset rules use their configured strict entries"
        },
        {
          "name": "should prefix every rule key with the plugin namespace",
          "given": "any preset is passed to buildRules",
          "when": "Object.keys of the result is inspected",
          "then": "every key starts with 'zero-tolerance/'"
        },
        {
          "name": "should include max-function-lines with parameterised severity",
          "given": "buildRules is called with Preset.Recommended",
          "when": "the 'zero-tolerance/max-function-lines' entry is read",
          "then": "returns an array entry with 'warn' and the recommended max-lines option"
        },
        {
          "name": "should keep prefer-result-return relaxed in built-in presets",
          "given": "buildRules is called for the Recommended and Strict presets",
          "when": "the 'zero-tolerance/prefer-result-return' entries are read",
          "then": "the rule is set to off in Recommended and warn in Strict"
        },
        {
          "name": "should keep require-bdd-spec disabled in both built-in presets",
          "given": "buildRules is called for the Recommended and Strict presets",
          "when": "the 'zero-tolerance/require-bdd-spec' entries are read",
          "then": "both preset entries are set to 'off' so the rule stays opt-in by default"
        },
        {
          "name": "should include no-parent-imports in built-in presets",
          "given": "buildRules is called for the Recommended and Strict presets",
          "when": "the 'zero-tolerance/no-parent-imports' entries are read",
          "then": "the rule is set to warn in Recommended and error in Strict"
        },
        {
          "name": "should include require-jsdoc-anonymous-functions in built-in presets",
          "given": "buildRules is called for the Recommended and Strict presets",
          "when": "the 'zero-tolerance/require-jsdoc-anonymous-functions' entries are read",
          "then": "the rule is set to off in Recommended and warn in Strict"
        },
        {
          "name": "should include require-clean-barrel in built-in presets",
          "given": "buildRules is called for the Recommended and Strict presets",
          "when": "the 'zero-tolerance/require-clean-barrel' entries are read",
          "then": "the rule is set to warn in Recommended and error in Strict"
        }
      ]
    }
  ]
}
