{
  "$schema": "../../../../bdd-spec.schema.json",
  "schemaVersion": "1.0.0",
  "sourceFile": "packages/plugin/src/configs/recommended.ts",
  "module": {
    "name": "configs/recommended",
    "description": "Factory that creates the recommended flat ESLint config preset with warn-level rule enforcement.",
    "exports": ["IPluginFlatConfig", "createRecommendedConfig"]
  },
  "specifications": [
    {
      "feature": "createRecommendedConfig",
      "scenarios": [
        {
          "name": "should return a flat config with the correct name",
          "given": "a plugin instance is passed to createRecommendedConfig",
          "when": "createRecommendedConfig is called",
          "then": "the returned config has name 'zero-tolerance/recommended'"
        },
        {
          "name": "should register the supplied plugin under the zero-tolerance namespace",
          "given": "a plugin instance is passed to createRecommendedConfig",
          "when": "the returned config's plugins record is inspected",
          "then": "it contains the plugin under the key 'zero-tolerance'"
        },
        {
          "name": "should include warn-level rules from the recommended preset",
          "given": "a plugin instance is passed to createRecommendedConfig",
          "when": "the returned config's rules record is inspected",
          "then": "all rule entries have 'warn' severity"
        }
      ]
    }
  ]
}
