{
  "$schema": "../../../../bdd-spec.schema.json",
  "schemaVersion": "1.0.0",
  "sourceFile": "packages/plugin/src/rules/no-unsafe-code-generation.ts",
  "module": {
    "name": "no-unsafe-code-generation",
    "description": "Disallow eval, Function constructors, string timers, and vm code execution APIs.",
    "exports": ["noUnsafeCodeGeneration"]
  },
  "specifications": [
    {
      "feature": "Dynamic code execution detection",
      "scenarios": [
        {
          "name": "should allow function timer callbacks and shadowed global names",
          "given": "code using function callbacks for timers, local bindings named Function or setTimeout, or arbitrary object methods named like timers",
          "when": "the rule evaluates the call",
          "then": "no violation is reported"
        },
        {
          "name": "should report eval, Function, and string timer callbacks",
          "given": "code that executes source strings through globals or timer callbacks expressed as literals, static templates, interpolation, or concatenation",
          "when": "the rule evaluates the call or constructor",
          "then": "an unsafeCodeGeneration violation is reported"
        },
        {
          "name": "should report Node vm execution APIs",
          "given": "code importing vm namespaces or vm execution helpers",
          "when": "the rule evaluates the vm call or constructor",
          "then": "an unsafeCodeGeneration violation is reported"
        }
      ]
    },
    {
      "feature": "Parsing and false-positive regressions",
      "scenarios": [
        {
          "name": "should ignore unrelated and shadowed eval and Function members",
          "given": "methods named eval or Function on arbitrary or locally shadowed objects",
          "when": "calls and constructors are linted",
          "then": "no global code generation diagnostic is emitted"
        },
        {
          "name": "should distinguish static computed global API access from dynamic keys",
          "given": "literal string keys and identifier keys on global objects",
          "when": "the rule resolves the callee",
          "then": "only statically identified unshadowed global APIs are reported"
        }
      ]
    }
  ]
}
